Title,Link,pubDate,Description,Source,Query,Alexa Rank
Out-Of-State Hunter Pays $115k For Bighorn Sheep Hunting Tag At Lander Event - Cowboy State Daily,https://cowboystatedaily.com/2022/06/08/explainer-why-would-people-pay-115k-to-hunt-bighorn-sheep-in-wyoming/,2022/06/08,Out-Of-State Hunter Pays $115k For Bighorn Sheep Hunting Tag At Lander Event&nbsp;&nbsp;Cowboy State Daily,Cowboy State Daily,Wildlife Conservation,
"Indonesian official charged, but not jailed, for trading in Sumatran tiger parts - Mongabay.com",https://news.mongabay.com/2022/06/indonesian-official-charged-but-not-jailed-for-trading-in-sumatran-tiger-parts/,2022/06/07,"Indonesian official charged, but not jailed, for trading in Sumatran tiger parts&nbsp;&nbsp;Mongabay.com",Mongabay.com,Wildlife Conservation,
Florida Fisherman Photographs Alligator Trying to Take on a Bull Shark - Outdoor Life,https://www.outdoorlife.com/survival/alligator-tries-to-eat-bull-shark/,2022/06/08,Florida Fisherman Photographs Alligator Trying to Take on a Bull Shark&nbsp;&nbsp;Outdoor Life,Outdoor Life,Wildlife Conservation,
Size Matters to Backpackers: BearVault® Launches Two Smaller Bear Canisters - PR Newswire,https://www.prnewswire.com/news-releases/size-matters-to-backpackers-bearvault-launches-two-smaller-bear-canisters-301564937.html,2022/06/09,Size Matters to Backpackers: BearVault® Launches Two Smaller Bear Canisters&nbsp;&nbsp;PR Newswire,PR Newswire,Wildlife Conservation,
How you can help turtles | US Fish & Wildlife Service - US Fish and Wildlife Service,https://www.fws.gov/story/how-you-can-help-turtles,2022/05/19,How you can help turtles | US Fish & Wildlife Service&nbsp;&nbsp;US Fish and Wildlife Service,US Fish and Wildlife Service,Wildlife Conservation,
How much land is needed to stop the biodiversity crisis? - Anthropocene Magazine,https://www.anthropocenemagazine.org/2022/06/how-much-land-is-needed-to-stop-the-biodiversity-crisis/,2022/06/08,How much land is needed to stop the biodiversity crisis?&nbsp;&nbsp;Anthropocene Magazine,Anthropocene Magazine,Wildlife Conservation,
Bill offers opportunity to fund threatened wildlife in Kansas without new taxes - Kansas Reflector,https://kansasreflector.com/2022/05/23/bill-offers-opportunity-to-fund-threatened-wildlife-in-kansas-without-new-taxes/,2022/05/23,Bill offers opportunity to fund threatened wildlife in Kansas without new taxes&nbsp;&nbsp;Kansas Reflector,Kansas Reflector,Wildlife Conservation,
"Conservation Board Approves Improvement, Acquisition Projects - Escalon Times",https://www.escalontimes.com/news/conservation-board-approves-improvement-acquisition-projects1/,2022/06/01,"Conservation Board Approves Improvement, Acquisition Projects&nbsp;&nbsp;Escalon Times",Escalon Times,Wildlife Conservation,
How innovative financing can help protect the black rhino population - World Economic Forum,https://www.weforum.org/agenda/2022/05/wildlife-conservation-bond-innovative-financing-to-achieve-results-for-rhinos/,2022/05/12,How innovative financing can help protect the black rhino population&nbsp;&nbsp;World Economic Forum,World Economic Forum,Wildlife Conservation,
More efforts to conserve pangolin carried out - http://en.vietnamplus.vn/,https://en.vietnamplus.vn/more-efforts-to-conserve-pangolin-carried-out/230897.vnp,2022/06/09,More efforts to conserve pangolin carried out&nbsp;&nbsp;http://en.vietnamplus.vn/,http://en.vietnamplus.vn/,Wildlife Conservation,
BLM kicks off Great Outdoors Month with two acquisitions through the Land and Water Conservation Fund - Bureau of Land Management,https://www.blm.gov/press-release/blm-kicks-great-outdoors-month-with-2-acquisitions-through-land-and-water-conservation-fund,2022/06/02,BLM kicks off Great Outdoors Month with two acquisitions through the Land and Water Conservation Fund&nbsp;&nbsp;Bureau of Land Management,Bureau of Land Management,Wildlife Conservation,
Uganda: Totalenergies Launches Biodiversity Conservation Program for Its Tilenga Oil Project - AllAfrica - Top Africa News,https://allafrica.com/stories/202206090434.html,2022/06/08,Uganda: Totalenergies Launches Biodiversity Conservation Program for Its Tilenga Oil Project&nbsp;&nbsp;AllAfrica - Top Africa News,AllAfrica - Top Africa News,Wildlife Conservation,
"Video shows deadly abuse of an octopus, and a Keys stone-crab fisherman is charged - Miami Herald",https://www.miamiherald.com/news/local/community/florida-keys/article262292062.html,2022/06/08,"Video shows deadly abuse of an octopus, and a Keys stone-crab fisherman is charged&nbsp;&nbsp;Miami Herald",Miami Herald,Wildlife Conservation,
Newsletter 2022-06-09 - Mongabay.com,https://news.mongabay.com/newsletter/newsletter-2022-06-09/,2022/06/09,Newsletter 2022-06-09&nbsp;&nbsp;Mongabay.com,Mongabay.com,Wildlife Conservation,
Innovation Center for U.S. Dairy Announces 2022 Sustainability Award Winners - Dairy Herd Management,https://www.dairyherd.com/news/business/innovation-center-us-dairy-announces-2022-sustainability-award-winners,2022/06/08,Innovation Center for U.S. Dairy Announces 2022 Sustainability Award Winners&nbsp;&nbsp;Dairy Herd Management,Dairy Herd Management,Wildlife Conservation,
Enjoying the spoils - SpaceCoast Living,https://spacecoastliving.com/enjoying-the-spoils/,2022/06/08,Enjoying the spoils&nbsp;&nbsp;SpaceCoast Living,SpaceCoast Living,Wildlife Conservation,
Tiger-centric conservation efforts push other predators to the fringes - Mongabay.com,https://news.mongabay.com/2022/05/tiger-centric-conservation-efforts-push-other-predators-to-the-fringes/,2022/05/24,Tiger-centric conservation efforts push other predators to the fringes&nbsp;&nbsp;Mongabay.com,Mongabay.com,Wildlife Conservation,
Federal officials agree to update Florida manatees' protected habitat for the first time in 50 years - CNN,https://www.cnn.com/2022/06/05/us/florida-manatee-habitat-expansion-scn-trnd/index.html,2022/06/05,Federal officials agree to update Florida manatees' protected habitat for the first time in 50 years&nbsp;&nbsp;CNN,CNN,Wildlife Conservation,
Police: Largo man missing three limbs in gator-infested lake - Bay News 9,https://www.baynews9.com/fl/tampa/news/2022/06/08/gator-taylor-lake-mcguinness,2022/06/08,Police: Largo man missing three limbs in gator-infested lake&nbsp;&nbsp;Bay News 9,Bay News 9,Wildlife Conservation,
"CDFW News | Lake Tahoe to Receive 100,000 Lahontan Cutthroat Trout This Summer: Agencies, Washoe Tribe Unite to Return Native Trout to Lake Tahoe - California Department of Fish and Wildlife",https://wildlife.ca.gov/News/lake-tahoe-to-receive-100000-lahontan-cutthroat-trout-this-summer,2022/06/03,"CDFW News | Lake Tahoe to Receive 100,000 Lahontan Cutthroat Trout This Summer: Agencies, Washoe Tribe Unite to Return Native Trout to Lake Tahoe&nbsp;&nbsp;California Department of Fish and Wildlife",California Department of Fish and Wildlife,Wildlife Conservation,
Wildlife photographer has close encounter with black bear and films the whole thing - DIYphotography,https://www.diyphotography.net/wildlife-photographer-has-close-encounter-with-black-bear-and-films-the-whole-thing/,2022/06/07,Wildlife photographer has close encounter with black bear and films the whole thing&nbsp;&nbsp;DIYphotography,DIYphotography,Wildlife Conservation,
Karnataka forest department's website now has section for animal post-mortem reports - The Indian Express,https://indianexpress.com/article/cities/bangalore/karnataka-forest-departments-website-section-animal-post-mortem-reports-7960974/,2022/06/09,Karnataka forest department's website now has section for animal post-mortem reports&nbsp;&nbsp;The Indian Express,The Indian Express,Wildlife Conservation,
National Fishing and Boating Week | US Fish & Wildlife Service - US Fish and Wildlife Service,https://www.fws.gov/story/national-fishing-and-boating-week,2022/06/09,National Fishing and Boating Week | US Fish & Wildlife Service&nbsp;&nbsp;US Fish and Wildlife Service,US Fish and Wildlife Service,Wildlife Conservation,
"Florida Towns Are Asking Residents And Visitors To Close Blinds, Turn Off Lights, Here’s Why - TravelAwaits",https://www.travelawaits.com/2771241/florida-helps-sea-turtles-by-turning-off-lights-closing-blinds/,2022/06/08,"Florida Towns Are Asking Residents And Visitors To Close Blinds, Turn Off Lights, Here’s Why&nbsp;&nbsp;TravelAwaits",TravelAwaits,Wildlife Conservation,
"As Animals Migrate Because of Climate Change, Thousands of New Viruses Will Hop From Wildlife to Humans—and Mitigation Won't Stop Them - InsideClimate News",https://insideclimatenews.org/news/07062022/monkeypox-zoonotic-diseases-spread-climate-change/,2022/06/07,"As Animals Migrate Because of Climate Change, Thousands of New Viruses Will Hop From Wildlife to Humans—and Mitigation Won't Stop Them&nbsp;&nbsp;InsideClimate News",InsideClimate News,Wildlife Conservation,
Baiting a Brookie : The wildflowers of Western North Carolina's mountain streams - wncmagazine.com,https://wncmagazine.com/feature/baiting_brookie,2022/06/09,Baiting a Brookie : The wildflowers of Western North Carolina's mountain streams&nbsp;&nbsp;wncmagazine.com,wncmagazine.com,Wildlife Conservation,
Blood Sport - Earth Island Journal,https://www.earthisland.org/journal/index.php/magazine/entry/blood-sport-west-texas-bobcat-contest,2022/06/09,Blood Sport&nbsp;&nbsp;Earth Island Journal,Earth Island Journal,Wildlife Conservation,
Audubon Scientists Develop New Method to Improve Mapping of Bird Migrations | Audubon - National Audubon Society,https://www.audubon.org/news/audubon-scientists-develop-new-method-improve-mapping-bird-migrations,2022/06/01,Audubon Scientists Develop New Method to Improve Mapping of Bird Migrations | Audubon&nbsp;&nbsp;National Audubon Society,National Audubon Society,Wildlife Conservation,
"Enclosures, beachgoers, nature knows best - The Anna Maria Islander",https://www.islander.org/2022/06/enclosures-beachgoers-nature-knows-best/,2022/06/07,"Enclosures, beachgoers, nature knows best&nbsp;&nbsp;The Anna Maria Islander",The Anna Maria Islander,Wildlife Conservation,
Wyoming Wilderness Bill On The Table - The Wildlife News,https://www.thewildlifenews.com/2022/06/08/wyoming-wilderness-bill-on-the-table/,2022/06/08,Wyoming Wilderness Bill On The Table&nbsp;&nbsp;The Wildlife News,The Wildlife News,Wildlife Conservation,
Wildlife Conservation | US Fish & Wildlife Service - US Fish and Wildlife Service,https://www.fws.gov/initiative/hunting/wildlife-conservation,2022/04/11,Wildlife Conservation | US Fish & Wildlife Service&nbsp;&nbsp;US Fish and Wildlife Service,US Fish and Wildlife Service,Wildlife Conservation,
Interior Department Announces Over $1.5 Billion to Support State Wildlife Conservation and Outdoor Recreation - US Department of the Interior,https://www.doi.gov/pressreleases/interior-department-announces-over-15-billion-support-state-wildlife-conservation-and,2022/02/11,Interior Department Announces Over $1.5 Billion to Support State Wildlife Conservation and Outdoor Recreation&nbsp;&nbsp;US Department of the Interior,US Department of the Interior,Wildlife Conservation,
POV: The Secret to Wildlife Conservation Might Be the “Animal Agency” Approach—Giving Creatures a Role in Their Own Preservation - Boston University,https://www.bu.edu/articles/2022/key-to-wildlife-conservation-might-be-animal-agency-approach/,2022/03/09,POV: The Secret to Wildlife Conservation Might Be the “Animal Agency” Approach—Giving Creatures a Role in Their Own Preservation&nbsp;&nbsp;Boston University,Boston University,Wildlife Conservation,
What is people-centered tiger conservation? | Stories - World Wildlife Fund,https://www.worldwildlife.org/stories/what-is-people-centered-tiger-conservation,2022/04/05,What is people-centered tiger conservation? | Stories&nbsp;&nbsp;World Wildlife Fund,World Wildlife Fund,Wildlife Conservation,
Zoo and Wildlife Society hosts first Wildlife Conservation Day | Cornell Chronicle - Cornell Chronicle,https://news.cornell.edu/stories/2022/03/zoo-and-wildlife-society-hosts-first-wildlife-conservation-day,2022/03/18,Zoo and Wildlife Society hosts first Wildlife Conservation Day | Cornell Chronicle&nbsp;&nbsp;Cornell Chronicle,Cornell Chronicle,Wildlife Conservation,
CDFW News | Wildlife Conservation Board Funds Environmental Improvement and Acquisition Projects - California Department of Fish and Wildlife,https://wildlife.ca.gov/News/wildlife-conservation-board-funds-environmental-improvement-and-acquisition-projects1,2022/02/25,CDFW News | Wildlife Conservation Board Funds Environmental Improvement and Acquisition Projects&nbsp;&nbsp;California Department of Fish and Wildlife,California Department of Fish and Wildlife,Wildlife Conservation,
Hunters as Conservationists | US Fish & Wildlife Service - US Fish and Wildlife Service,https://www.fws.gov/story/hunters-conservationists,2022/03/01,Hunters as Conservationists | US Fish & Wildlife Service&nbsp;&nbsp;US Fish and Wildlife Service,US Fish and Wildlife Service,Wildlife Conservation,
U.S. Department of Agriculture Announces New Advisor on Wildlife Conservation - USDA.gov,https://www.usda.gov/media/press-releases/2022/01/19/us-department-agriculture-announces-new-advisor-wildlife,2022/01/19,U.S. Department of Agriculture Announces New Advisor on Wildlife Conservation&nbsp;&nbsp;USDA.gov,USDA.gov,Wildlife Conservation,
NC State Student Supports Wildlife Conservation in Africa - NC State College of Natural Resources News,https://cnr.ncsu.edu/news/2022/01/nc-state-student-supports-wildlife-conservation-in-africa/,2022/01/24,NC State Student Supports Wildlife Conservation in Africa&nbsp;&nbsp;NC State College of Natural Resources News,NC State College of Natural Resources News,Wildlife Conservation,
"Oregon, Washington hope for wildlife conservation funding from bill advancing in US Senate - Oregon Public Broadcasting",https://www.opb.org/article/2022/04/11/oregon-washington-conservation-funding-recovering-americas-wildlife-act/,2022/04/10,"Oregon, Washington hope for wildlife conservation funding from bill advancing in US Senate&nbsp;&nbsp;Oregon Public Broadcasting",Oregon Public Broadcasting,Wildlife Conservation,
"Commencement 2022: URI wildlife, conservation biology graduate ready for his career to take flight - University of Rhode Island",https://www.uri.edu/news/2022/05/commencement-2022-uri-wildlife-conservation-biology-graduate-ready-for-his-career-to-take-flight/,2022/05/09,"Commencement 2022: URI wildlife, conservation biology graduate ready for his career to take flight&nbsp;&nbsp;University of Rhode Island",University of Rhode Island,Wildlife Conservation,
A new lifeline for wildlife conservation finance - Global Environment Facility,https://www.thegef.org/newsroom/blog/new-lifeline-wildlife-conservation-finance,2022/03/23,A new lifeline for wildlife conservation finance&nbsp;&nbsp;Global Environment Facility,Global Environment Facility,Wildlife Conservation,
Opinion: Portman has been a strong advocate for wildlife conservation - The Cincinnati Enquirer,https://www.cincinnati.com/story/opinion/2022/04/30/opinion-portman-has-been-strong-advocate-wildlife-conservation/9585373002/,2022/04/30,Opinion: Portman has been a strong advocate for wildlife conservation&nbsp;&nbsp;The Cincinnati Enquirer,The Cincinnati Enquirer,Wildlife Conservation,
"Manchin, Capito Announce U.S. Fish and Wildlife Conservation Funding - Joe Manchin",https://www.manchin.senate.gov/newsroom/press-releases/manchin-capito-announce-us-fish-and-wildlife-conservation-funding,2022/04/27,"Manchin, Capito Announce U.S. Fish and Wildlife Conservation Funding&nbsp;&nbsp;Joe Manchin",Joe Manchin,Wildlife Conservation,
Candidate Conservation Agreements with Assurances | US Fish & Wildlife Service - US Fish and Wildlife Service,https://www.fws.gov/service/candidate-conservation-agreements-assurances,1973/12/28,Candidate Conservation Agreements with Assurances | US Fish & Wildlife Service&nbsp;&nbsp;US Fish and Wildlife Service,US Fish and Wildlife Service,Wildlife Conservation,
Bill Text - AB-2610 Wildlife Conservation Board: vegetation management: fire reduction. - California Legislative Information,https://leginfo.legislature.ca.gov/faces/billTextClient.xhtml?bill_id=202120220AB2610,2022/02/19,Bill Text - AB-2610 Wildlife Conservation Board: vegetation management: fire reduction.&nbsp;&nbsp;California Legislative Information,California Legislative Information,Wildlife Conservation,
Wildlife Conservation Camp deadline approaches - Texas Farm Bureau,https://texasfarmbureau.org/wildlife-conservation-camp-deadline-approaches/,2022/05/04,Wildlife Conservation Camp deadline approaches&nbsp;&nbsp;Texas Farm Bureau,Texas Farm Bureau,Wildlife Conservation,
Billions targeted to state wildlife conservation under bipartisan push in Congress - Colorado Newsline,https://coloradonewsline.com/briefs/wildlife-conservation-bipartisan-push-in-congress/,2021/12/09,Billions targeted to state wildlife conservation under bipartisan push in Congress&nbsp;&nbsp;Colorado Newsline,Colorado Newsline,Wildlife Conservation,
DLNR News Release: HAWAI'I WILDLIFE CONSERVATION STAMP CONTEST OPENS - David Y. Ige | Newsroom,https://governor.hawaii.gov/newsroom/dlnr-news-release-hawaii-wildlife-conservation-stamp-contest-opens-2/,2021/11/22,DLNR News Release: HAWAI'I WILDLIFE CONSERVATION STAMP CONTEST OPENS&nbsp;&nbsp;David Y. Ige | Newsroom,David Y. Ige | Newsroom,Wildlife Conservation,
"Interior and Agriculture Departments Invite Nominations for Federal Council to Support Hunting, Conservation Efforts - US Department of the Interior",https://www.doi.gov/pressreleases/interior-and-agriculture-departments-invite-nominations-federal-council-support,2022/02/17,"Interior and Agriculture Departments Invite Nominations for Federal Council to Support Hunting, Conservation Efforts&nbsp;&nbsp;US Department of the Interior",US Department of the Interior,Wildlife Conservation,
