Title,Link,pubDate,Description,Source,Query,Alexa Rank
Satellite remote sensing could predict spotted lanternfly spread - Purdue University,https://www.purdue.edu/newsroom/releases/2022/Q2/satellite-remote-sensing-could-predict-spotted-lanternfly-spread.html,2022/05/25,Satellite remote sensing could predict spotted lanternfly spread&nbsp;&nbsp;Purdue University,Purdue University,Remote Sensing,
SPIE Journal of Applied Remote Sensing honors best papers published in 2021 - Novus Light Technologies Today,https://www.novuslight.com/spie-journal-of-applied-remote-sensing-honors-best-papers-published-in-2021_N12411.html,2022/06/08,SPIE Journal of Applied Remote Sensing honors best papers published in 2021&nbsp;&nbsp;Novus Light Technologies Today,Novus Light Technologies Today,Remote Sensing,
Studying grassland from space - Phys.org,https://phys.org/news/2022-06-grassland-space.html,2022/06/09,Studying grassland from space&nbsp;&nbsp;Phys.org,Phys.org,Remote Sensing,
"Research Fellow, Ecological Remote Sensing Scientist job with LA TROBE UNIVERSITY | 296719 - Times Higher Education",https://www.timeshighereducation.com/unijobs/listing/296719/research-fellow-ecological-remote-sensing-scientist/?trackid=10&utm_source=the-jobs-service,2022/06/09,"Research Fellow, Ecological Remote Sensing Scientist job with LA TROBE UNIVERSITY | 296719&nbsp;&nbsp;Times Higher Education",Times Higher Education,Remote Sensing,
House armed services panel calls on DoD to buy commercial space technology and data - SpaceNews,https://spacenews.com/house-armed-services-panel-calls-on-dod-to-buy-commercial-space-technology-and-data/,2022/06/08,House armed services panel calls on DoD to buy commercial space technology and data&nbsp;&nbsp;SpaceNews,SpaceNews,Remote Sensing,
Global Remote Sensing Software Market To Be Driven By The Increasing Application Of The Software In The Defence And Homeland Security Sector In The Forecast Period Of 2022-2027 - Digital Journal,https://www.digitaljournal.com/pr/global-remote-sensing-software-market-to-be-driven-by-the-increasing-application-of-the-software-in-the-defence-and-homeland-security-sector-in-the-forecast-period-of-2022-2027,2022/06/08,Global Remote Sensing Software Market To Be Driven By The Increasing Application Of The Software In The Defence And Homeland Security Sector In The Forecast Period Of 2022-2027&nbsp;&nbsp;Digital Journal,Digital Journal,Remote Sensing,
Remote Sensing – The Lookout - The Lookout.org,https://the-lookout.org/category/remote-sensing/,2022/05/14,Remote Sensing – The Lookout&nbsp;&nbsp;The Lookout.org,The Lookout.org,Remote Sensing,
Satellogic Selected as a Finalist by the European Association of Remote Sensing Companies for its “Company Award 2022” - Business Wire,https://www.businesswire.com/news/home/20220607005470/en/Satellogic-Selected-as-a-Finalist-by-the-European-Association-of-Remote-Sensing-Companies-for-its-%E2%80%9CCompany-Award-2022%E2%80%9D,2022/06/07,Satellogic Selected as a Finalist by the European Association of Remote Sensing Companies for its “Company Award 2022”&nbsp;&nbsp;Business Wire,Business Wire,Remote Sensing,
Remote sensing research improves hurricane response - Science Daily,https://www.sciencedaily.com/releases/2022/05/220513134855.htm,2022/05/13,Remote sensing research improves hurricane response&nbsp;&nbsp;Science Daily,Science Daily,Remote Sensing,
HS2 testing artificial and remote sensing technologies for station design - New Civil Engineer,https://www.newcivilengineer.com/latest/hs2-testing-artificial-and-remote-sensing-technologies-for-station-design-08-06-2022/,2022/06/08,HS2 testing artificial and remote sensing technologies for station design&nbsp;&nbsp;New Civil Engineer,New Civil Engineer,Remote Sensing,
Leveraging Commercial Space for Earth and Ocean Remote Sensing - SpaceNews,https://spacenews.com/event/leveraging-commercial-space-for-earth-and-ocean-remote-sensing/,2022/05/12,Leveraging Commercial Space for Earth and Ocean Remote Sensing&nbsp;&nbsp;SpaceNews,SpaceNews,Remote Sensing,
Improving Air Quality with Remote Sensing Technology - AZoSensors,https://www.azosensors.com/article.aspx?ArticleID=2566,2022/05/31,Improving Air Quality with Remote Sensing Technology&nbsp;&nbsp;AZoSensors,AZoSensors,Remote Sensing,
Remote sensing workshop at BGSU | Community | sent-trib.com - Sentinel-Tribune,https://www.sent-trib.com/community/remote-sensing-workshop-at-bgsu/article_1da0dc36-dc28-11ec-a9eb-43a49e8d3f4f.html,2022/05/25,Remote sensing workshop at BGSU | Community | sent-trib.com&nbsp;&nbsp;Sentinel-Tribune,Sentinel-Tribune,Remote Sensing,
Remote sensing can track the availability of flowers for pollinators - ZME Science,https://www.zmescience.com/science/news-science/remote-sensing-can-track-the-availability-of-flowers-for-pollinators/,2022/05/21,Remote sensing can track the availability of flowers for pollinators&nbsp;&nbsp;ZME Science,ZME Science,Remote Sensing,
Drone conference at SUNY ESF explores remote sensing in environmental settings - WAER,https://www.waer.org/news/2022-05-24/drone-conference-at-suny-esf-explores-remote-sensing-in-environmental-settings,2022/05/24,Drone conference at SUNY ESF explores remote sensing in environmental settings&nbsp;&nbsp;WAER,WAER,Remote Sensing,
Build-a-satellite program could fast track national security space missions - EurekAlert,https://www.eurekalert.org/news-releases/955378,2022/06/09,Build-a-satellite program could fast track national security space missions&nbsp;&nbsp;EurekAlert,EurekAlert,Remote Sensing,
UK Statement on Space '2030' at the UN Committee on the Peaceful Uses of Outer Space (COPUOS) - GOV.UK,https://www.gov.uk/government/news/uk-statement-on-space-2030-at-the-un-committee-on-the-peaceful-uses-of-outer-space-copuos,2022/06/09,UK Statement on Space '2030' at the UN Committee on the Peaceful Uses of Outer Space (COPUOS)&nbsp;&nbsp;GOV.UK,GOV.UK,Remote Sensing,
Air lasing: A new tool for atmospheric detection - Phys.org,https://phys.org/news/2022-06-air-lasing-tool-atmospheric.html,2022/06/09,Air lasing: A new tool for atmospheric detection&nbsp;&nbsp;Phys.org,Phys.org,Remote Sensing,
Label-free complete absorption microscopy using second generation photoacoustic remote sensing | Scientific Reports - Nature.com,https://www.nature.com/articles/s41598-022-11235-3,2022/05/19,Label-free complete absorption microscopy using second generation photoacoustic remote sensing | Scientific Reports&nbsp;&nbsp;Nature.com,Nature.com,Remote Sensing,
"US, Thailand sign landmark information exchange agreement > Air Force > Article Display - Air Force Link",https://www.af.mil/News/Article-Display/Article/3057019/us-thailand-sign-landmark-information-exchange-agreement/,2022/06/08,"US, Thailand sign landmark information exchange agreement > Air Force > Article Display&nbsp;&nbsp;Air Force Link",Air Force Link,Remote Sensing,
All-printed soft human-machine interface for robotic physicochemical sensing - Science,https://www.science.org/doi/10.1126/scirobotics.abn0495,2022/06/01,All-printed soft human-machine interface for robotic physicochemical sensing&nbsp;&nbsp;Science,Science,Remote Sensing,
Commercial Satellites Are National Security’s Next Frontier - IEEE Spectrum,https://spectrum.ieee.org/commercial-satellite-imagery-national-security162,2022/06/09,Commercial Satellites Are National Security’s Next Frontier&nbsp;&nbsp;IEEE Spectrum,IEEE Spectrum,Remote Sensing,
Gross polluters and vehicle emissions reduction - Nature.com,https://www.nature.com/articles/s41893-022-00903-x,2022/06/09,Gross polluters and vehicle emissions reduction&nbsp;&nbsp;Nature.com,Nature.com,Remote Sensing,
Incorporation of machine learning and deep neural network approaches into a remote sensing-integrated crop model for the simulation of rice growth | Scientific Reports - Nature.com,https://www.nature.com/articles/s41598-022-13232-y,2022/05/30,Incorporation of machine learning and deep neural network approaches into a remote sensing-integrated crop model for the simulation of rice growth | Scientific Reports&nbsp;&nbsp;Nature.com,Nature.com,Remote Sensing,
Interferometry Provides a Basis for LWIR Remote Thermal Imaging - Photonics.com,https://www.photonics.com/Articles/Interferometry_Provides_a_Basis_for_LWIR_Remote/a68090,2022/06/09,Interferometry Provides a Basis for LWIR Remote Thermal Imaging&nbsp;&nbsp;Photonics.com,Photonics.com,Remote Sensing,
PhilSA official elected as president of Outreach Technical Commission of ISPRS - Manila Bulletin,https://mb.com.ph/2022/06/09/philsa-official-elected-as-president-of-outreach-technical-commission-of-isprs/,2022/06/09,PhilSA official elected as president of Outreach Technical Commission of ISPRS&nbsp;&nbsp;Manila Bulletin,Manila Bulletin,Remote Sensing,
Methane emissions detected over offshore platform in the Gulf of Mexico - ESA Science & Technology,https://www.esa.int/Applications/Observing_the_Earth/Methane_emissions_detected_over_offshore_platform_in_the_Gulf_of_Mexico,2022/06/09,Methane emissions detected over offshore platform in the Gulf of Mexico&nbsp;&nbsp;ESA Science & Technology,ESA Science & Technology,Remote Sensing,
"Remote Sensing Satellites Market 2022 Size, Share, Overall Study Report with Top Key Players and Application 2030 - Taiwan News",https://www.taiwannews.com.tw/en/news/4561583,2022/06/05,"Remote Sensing Satellites Market 2022 Size, Share, Overall Study Report with Top Key Players and Application 2030&nbsp;&nbsp;Taiwan News",Taiwan News,Remote Sensing,
Media Alert: Helicopter Will Survey Portions of the Colorado River Basin for Water Studies | US Geological Survey - United States Geological Survey (.gov),https://www.usgs.gov/news/state-news-release/media-alert-helicopter-will-survey-portions-colorado-river-basin-water,2022/06/08,Media Alert: Helicopter Will Survey Portions of the Colorado River Basin for Water Studies | US Geological Survey&nbsp;&nbsp;United States Geological Survey (.gov),United States Geological Survey (.gov),Remote Sensing,
Ghaziabad civic body set to map infra with remote sensing survey - Hindustan Times,https://www.hindustantimes.com/cities/noida-news/ghaziabad-civic-body-set-to-map-infra-with-remote-sensing-survey-101654368390640.html,2022/06/04,Ghaziabad civic body set to map infra with remote sensing survey&nbsp;&nbsp;Hindustan Times,Hindustan Times,Remote Sensing,
How Thermal Infrared Mapping is Monitoring Our World - DirectionsMag.com,https://www.directionsmag.com/article/11536,2022/05/25,How Thermal Infrared Mapping is Monitoring Our World&nbsp;&nbsp;DirectionsMag.com,DirectionsMag.com,Remote Sensing,
Role of Geospatial Technology in Agriculture - Krishi Jagran,https://krishijagran.com/featured/role-of-geospatial-technology-in-agriculture/,2022/06/09,Role of Geospatial Technology in Agriculture&nbsp;&nbsp;Krishi Jagran ,Krishi Jagran,Remote Sensing,
Satellite Payload Global Market Report 2022 - Yahoo Finance,https://finance.yahoo.com/news/satellite-payload-global-market-report-131300909.html,2022/06/08,Satellite Payload Global Market Report 2022&nbsp;&nbsp;Yahoo Finance,Yahoo Finance,Remote Sensing,
Radar Agtech Brasil maps 1500 startups in world's 4th largest ag economy - AgFunderNews,https://agfundernews.com/radar-agtech-brasil-more-than-1500-startups-mapped-brazilian-agrifoodtech-innovation,2022/06/09,Radar Agtech Brasil maps 1500 startups in world's 4th largest ag economy&nbsp;&nbsp;AgFunderNews,AgFunderNews,Remote Sensing,
Lecturer in GIS and Remote Sensing job with SCOTLAND'S RURAL COLLEGE | 295316 - Times Higher Education,https://www.timeshighereducation.com/unijobs/listing/295316/lecturer-in-gis-and-remote-sensing/,2022/05/27,Lecturer in GIS and Remote Sensing job with SCOTLAND'S RURAL COLLEGE | 295316&nbsp;&nbsp;Times Higher Education,Times Higher Education,Remote Sensing,
Sapphire fibre makes a robust extreme-environment sensor – Physics World - physicsworld.com,https://physicsworld.com/a/sapphire-fibre-makes-a-robust-extreme-environment-sensor/,2022/06/08,Sapphire fibre makes a robust extreme-environment sensor – Physics World&nbsp;&nbsp;physicsworld.com,physicsworld.com,Remote Sensing,
Deep Learning for Ground and Non-ground Surface Separation - GIM International,https://www.gim-international.com/content/article/deep-learning-for-ground-and-non-ground-surface-separation,2022/06/09,Deep Learning for Ground and Non-ground Surface Separation&nbsp;&nbsp;GIM International,GIM International,Remote Sensing,
High-end server facility opened at Punjab Remote Sensing Centre - The Tribune India,https://m.tribuneindia.com/news/ludhiana/high-end-server-facility-opened-at-punjab-remote-sensing-centre-394452,2022/05/13,High-end server facility opened at Punjab Remote Sensing Centre&nbsp;&nbsp;The Tribune India,The Tribune India,Remote Sensing,
"Senior Lecturer / Associate Professor in Remote Sensing, Level C/D job with UNIVERSITY OF NEW ENGLAND | 293365 - Times Higher Education",https://www.timeshighereducation.com/unijobs/listing/293365/senior-lecturer-associate-professor-in-remote-sensing-level-c-d/,2022/05/13,"Senior Lecturer / Associate Professor in Remote Sensing, Level C/D job with UNIVERSITY OF NEW ENGLAND | 293365&nbsp;&nbsp;Times Higher Education",Times Higher Education,Remote Sensing,
Granicus Valles - NASA Jet Propulsion Laboratory,https://www.jpl.nasa.gov/images/pia25378-granicus-valles,2022/06/08,Granicus Valles&nbsp;&nbsp;NASA Jet Propulsion Laboratory,NASA Jet Propulsion Laboratory,Remote Sensing,
Egypt's Nilesat 301 communications satellite successfully launched into orbit - Society - Egypt - Ahram Online,https://english.ahram.org.eg/News/467658.aspx,2022/06/09,Egypt's Nilesat 301 communications satellite successfully launched into orbit - Society - Egypt&nbsp;&nbsp;Ahram Online,Ahram Online,Remote Sensing,
2 Indian satellites to be part of Brics ‘virtual constellation’: Report - Hindustan Times,https://www.hindustantimes.com/world-news/2-indian-satellites-to-be-part-brics-virtual-constellation-report-101653551552685.html,2022/05/27,2 Indian satellites to be part of Brics ‘virtual constellation’: Report&nbsp;&nbsp;Hindustan Times,Hindustan Times,Remote Sensing,
In Memoriam: Vytautas 'Vic' Klemas - UDaily,https://www.udel.edu/udaily/2022/may/in-memoriam-vytautas-vic-klemas/,2022/05/17,In Memoriam: Vytautas 'Vic' Klemas&nbsp;&nbsp;UDaily,UDaily,Remote Sensing,
NRL CIRCE spacecraft participate in Historic UK Launch – SatNews - SatNews,https://news.satnews.com/2022/06/07/nrl-circe-spacecraft-participate-in-historic-u-k-launch/,2022/06/08,NRL CIRCE spacecraft participate in Historic UK Launch – SatNews&nbsp;&nbsp;SatNews,SatNews,Remote Sensing,
"Satellite Sensor Market Outlook| Expansive Growth Opportunity with a CAGR of 3%, Latest Trends, Share, Challenges, and Forecast to 2022-2028 - Digital Journal",https://www.digitaljournal.com/pr/satellite-sensor-market-outlook-expansive-growth-opportunity-with-a-cagr-of-3-latest-trends-share-challenges-and-forecast-to-2022-2028,2022/06/09,"Satellite Sensor Market Outlook| Expansive Growth Opportunity with a CAGR of 3%, Latest Trends, Share, Challenges, and Forecast to 2022-2028&nbsp;&nbsp;Digital Journal",Digital Journal,Remote Sensing,
Simultaneous broadband image sensing and convolutional processing using van der Waals heterostructures - Tech Xplore,https://techxplore.com/news/2022-05-simultaneous-broadband-image-convolutional-van.html,2022/05/13,Simultaneous broadband image sensing and convolutional processing using van der Waals heterostructures&nbsp;&nbsp;Tech Xplore,Tech Xplore,Remote Sensing,
Digital Matter Receives 2022 IoT Evolution Asset Tracking Award for Oyster Edge - IoT Business News,https://iotbusinessnews.com/2022/06/09/45141-digital-matter-receives-2022-iot-evolution-asset-tracking-award-for-oyster-edge/,2022/06/09,Digital Matter Receives 2022 IoT Evolution Asset Tracking Award for Oyster Edge&nbsp;&nbsp;IoT Business News,IoT Business News,Remote Sensing,
Advancements TV Series to Explore Recent Developments in Design and Manufacturing Technology - PR Web,https://www.prweb.com/releases/advancements_tv_series_to_explore_recent_developments_in_design_and_manufacturing_technology/prweb18721397.htm,2022/06/09,Advancements TV Series to Explore Recent Developments in Design and Manufacturing Technology&nbsp;&nbsp;PR Web,PR Web,Remote Sensing,
Against Quad? China launches satellite-based Earth observation initiative with BRICS nations - SpaceNews,https://spacenews.com/against-quad-china-launches-satellite-based-earth-observation-initiative-with-brics-nations/,2022/05/31,Against Quad? China launches satellite-based Earth observation initiative with BRICS nations&nbsp;&nbsp;SpaceNews,SpaceNews,Remote Sensing,
A dedicated satellite launched to support the Asian Games 2022 - SHINE,https://www.shine.cn/news/nation/2206096600/,2022/06/09,A dedicated satellite launched to support the Asian Games 2022&nbsp;&nbsp;SHINE,SHINE,Remote Sensing,
Aerial imaging technique improves ability to detect and track moving targets through thick foliage - EurekAlert,https://www.eurekalert.org/news-releases/953671,2022/05/24,Aerial imaging technique improves ability to detect and track moving targets through thick foliage&nbsp;&nbsp;EurekAlert,EurekAlert,Remote Sensing,
Healthy Oceans Matter: Join NOAA in Celebrating National Ocean Month - US Department of Commerce,https://www.commerce.gov/news/blog/2022/06/healthy-oceans-matter-join-noaa-celebrating-national-ocean-month,2022/06/06,Healthy Oceans Matter: Join NOAA in Celebrating National Ocean Month&nbsp;&nbsp;US Department of Commerce,US Department of Commerce,Remote Sensing,
IDF unveils Negeva Combat Vehicle - TV7 ISRAEL NEWS,https://www.tv7israelnews.com/idf-unveils-negeva-combat-vehicle/,2022/06/09,IDF unveils Negeva Combat Vehicle&nbsp;&nbsp;TV7 ISRAEL NEWS,TV7 ISRAEL NEWS,Remote Sensing,
Senior Project Manager - Remote Monitoring of the Humanitarian Supply Chain - ReliefWeb,https://reliefweb.int/job/3848358/senior-project-manager-remote-monitoring-humanitarian-supply-chain,2022/05/19,Senior Project Manager - Remote Monitoring of the Humanitarian Supply Chain&nbsp;&nbsp;ReliefWeb,ReliefWeb,Remote Sensing,
NRG Systems Adds ZX TM Lidar to Remote Turbine Sensing Portfolio - North American Windpower - North American Windpower,https://nawindpower.com/nrg-systems-adds-zx-tm-lidar-to-remote-turbine-sensing-portfolio,2022/05/12,NRG Systems Adds ZX TM Lidar to Remote Turbine Sensing Portfolio - North American Windpower&nbsp;&nbsp;North American Windpower,North American Windpower,Remote Sensing,
"Lift off! China's space odyssey | Remote sensing satellite, the ""oil painter"" - Xinhua",https://english.news.cn/20220513/71a914c6d66b4310b0fb4a3089c780c8/c.html,2022/05/13,"Lift off! China's space odyssey | Remote sensing satellite, the ""oil painter""&nbsp;&nbsp;Xinhua",Xinhua,Remote Sensing,
Asteroid samples give insights into early solar system and life on Earth - Courthouse News Service,https://www.courthousenews.com/asteroid-samples-give-insights-into-early-solar-system-and-life-on-earth/,2022/06/09,Asteroid samples give insights into early solar system and life on Earth&nbsp;&nbsp;Courthouse News Service,Courthouse News Service,Remote Sensing,
Monitoring the impact of Arizona's drought | ASU News - ASU News Now,https://news.asu.edu/20220607-monitoring-impact-arizonas-drought,2022/06/07,Monitoring the impact of Arizona's drought | ASU News&nbsp;&nbsp;ASU News Now,ASU News Now,Remote Sensing,
Can conservation technology help save our rapidly disappearing species? | Problem Solved - Mongabay.com,https://news.mongabay.com/2022/06/can-conservation-technology-help-save-our-rapidly-disappearing-species-problem-solved/,2022/06/08,Can conservation technology help save our rapidly disappearing species? | Problem Solved&nbsp;&nbsp;Mongabay.com,Mongabay.com,Remote Sensing,
BeiDou and High-resolution Remote Sensing Integrated to Empower Regional Economy - Mirage News,https://www.miragenews.com/beidou-and-high-resolution-remote-sensing-791168/,2022/05/30,BeiDou and High-resolution Remote Sensing Integrated to Empower Regional Economy&nbsp;&nbsp;Mirage News,Mirage News,Remote Sensing,
"Satellite Communication Market in the Defense Sector - Growth, Trends, COVID-19 Impact, and Forecasts (2022 - 2027) - Yahoo Finance",https://finance.yahoo.com/news/satellite-communication-market-defense-sector-170500800.html,2022/06/07,"Satellite Communication Market in the Defense Sector - Growth, Trends, COVID-19 Impact, and Forecasts (2022 - 2027)&nbsp;&nbsp;Yahoo Finance",Yahoo Finance,Remote Sensing,
The delusive accuracy of global irrigation water withdrawal estimates - Nature.com,https://www.nature.com/articles/s41467-022-30731-8,2022/06/08,The delusive accuracy of global irrigation water withdrawal estimates&nbsp;&nbsp;Nature.com,Nature.com,Remote Sensing,
"Remote sensing facilitates sustainability of Bagan heritage site, Myanmar - Tech Xplore",https://techxplore.com/news/2022-05-remote-sustainability-bagan-heritage-site.html,2022/05/12,"Remote sensing facilitates sustainability of Bagan heritage site, Myanmar&nbsp;&nbsp;Tech Xplore",Tech Xplore,Remote Sensing,
Researchers use Google to measure climate change impact on coral reefs - Oceanographic - Oceanographic - Oceanographic Magazine,https://www.oceanographicmagazine.com/news/satellite-data-used-to-assess-coral-reefs/,2022/06/07,Researchers use Google to measure climate change impact on coral reefs - Oceanographic - Oceanographic&nbsp;&nbsp;Oceanographic Magazine,Oceanographic Magazine,Remote Sensing,
"LAZR: 2 Lidar Stocks That Will Double, According to Wall Street - StockNews.com",https://stocknews.com/news/lazr-lidr-2-lidar-stocks-that-will-double-according-to-wall-street/,2022/06/08,"LAZR: 2 Lidar Stocks That Will Double, According to Wall Street&nbsp;&nbsp;StockNews.com",StockNews.com,Remote Sensing,
Ocean Visions and Running Tide announce the formation of independent Scientific Advisory Board - Yahoo Finance,https://finance.yahoo.com/news/ocean-visions-running-tide-announce-110000001.html,2022/06/08,Ocean Visions and Running Tide announce the formation of independent Scientific Advisory Board&nbsp;&nbsp;Yahoo Finance,Yahoo Finance,Remote Sensing,
"Internet of Things in Agriculture Market Size to Reach USD 26.65 Billion in 2030 | Rising Demand for Implementation of Remote Sensing Technology in Agricultural Lands is a Key Factor Driving Industry Demand, Says Emergen Research - Yahoo Finance",https://finance.yahoo.com/news/internet-things-agriculture-market-size-133000845.html,2022/05/11,"Internet of Things in Agriculture Market Size to Reach USD 26.65 Billion in 2030 | Rising Demand for Implementation of Remote Sensing Technology in Agricultural Lands is a Key Factor Driving Industry Demand, Says Emergen Research&nbsp;&nbsp;Yahoo Finance",Yahoo Finance,Remote Sensing,
JUST IN: Ukraine War Called 'Catalyst' for Space-Based Remote Sensing Industry - National Defense Magazine,https://www.nationaldefensemagazine.org/articles/2022/3/22/ukraine-war-called-catalyst-for-space-based-remote-sensing-industry,2022/03/22,JUST IN: Ukraine War Called 'Catalyst' for Space-Based Remote Sensing Industry&nbsp;&nbsp;National Defense Magazine,National Defense Magazine,Remote Sensing,
SCD - SemiConductor Devices Detecting the invisible - The Jerusalem Post,https://www.jpost.com/special-content/scd-semiconductor-devices-detecting-the-invisible-708764,2022/06/08,SCD - SemiConductor Devices Detecting the invisible&nbsp;&nbsp;The Jerusalem Post,The Jerusalem Post,Remote Sensing,
Temasek pledges $3.6 billion for climate-focused investment platform - Reuters,https://www.reuters.com/markets/us/temasek-pledges-36-bln-climate-focused-investment-platform-2022-06-06/,2022/06/06,Temasek pledges $3.6 billion for climate-focused investment platform&nbsp;&nbsp;Reuters,Reuters,Remote Sensing,
European Space Agencys Comet Interceptor mission gets approval for construction - News9 LIVE,https://www.news9live.com/science/european-space-agencys-comet-interceptor-mission-gets-approval-for-construction-175307,2022/06/09,European Space Agencys Comet Interceptor mission gets approval for construction&nbsp;&nbsp;News9 LIVE,News9 LIVE,Remote Sensing,
Lidar reveals pre-Hispanic low-density urbanism in the Bolivian Amazon - Nature.com,https://www.nature.com/articles/s41586-022-04780-4,2022/05/25,Lidar reveals pre-Hispanic low-density urbanism in the Bolivian Amazon&nbsp;&nbsp;Nature.com,Nature.com,Remote Sensing,
GIEWS Country Brief: Timor-Leste 07-June-2022 - Timor-Leste - ReliefWeb,https://reliefweb.int/report/timor-leste/giews-country-brief-timor-leste-07-june-2022,2022/06/08,GIEWS Country Brief: Timor-Leste 07-June-2022 - Timor-Leste&nbsp;&nbsp;ReliefWeb,ReliefWeb,Remote Sensing,
Emerging technology gives first ever global view of hidden vessels - GlobeNewswire,https://www.globenewswire.com/news-release/2022/06/08/2458326/0/en/Emerging-technology-gives-first-ever-global-view-of-hidden-vessels.html,2022/06/08,Emerging technology gives first ever global view of hidden vessels&nbsp;&nbsp;GlobeNewswire,GlobeNewswire,Remote Sensing,
Uncovering Global Dust-Climate Connections | Michigan Tech Research Blog - Michigan Technological University,https://www.mtu.edu/unscripted/2022/05/uncovering-global-dustclimate-connections.html,2022/05/25,Uncovering Global Dust-Climate Connections | Michigan Tech Research Blog&nbsp;&nbsp;Michigan Technological University,Michigan Technological University,Remote Sensing,
Blue Canyon looks to demonstrate small-satellite performance at very low altitude - SpaceNews,https://spacenews.com/blue-canyon-looks-to-demonstrate-small-satellite-performance-at-very-low-altitude/,2022/06/05,Blue Canyon looks to demonstrate small-satellite performance at very low altitude&nbsp;&nbsp;SpaceNews,SpaceNews,Remote Sensing,
