Title,Link,pubDate,Description,Source,Tag
"Radar experts from Google, Ford, Infineon to explain new Ripple standard at Sensors Converge - FierceElectronics",https://www.fierceelectronics.com/sensors/radar-experts-google-ford-infineon-explain-new-ripple-standard-sensors-converge,6/14/2022,"Radar experts from Google, Ford, Infineon to explain new Ripple standard at Sensors Converge&nbsp;&nbsp;FierceElectronics",FierceElectronics,Sensors-Radar
"Offshore wind developers, conservation groups collaborate to protect birds - Port City Daily",https://portcitydaily.com/local-news/2022/05/29/offshore-wind-developers-conservation-groups-collaborate-to-protect-birds/,5/29/2022,"Offshore wind developers, conservation groups collaborate to protect birds&nbsp;&nbsp;Port City Daily",Port City Daily,Sensors-Radar
Emerging technology gives first ever global view of hidden vessels - GlobeNewswire,https://www.globenewswire.com/news-release/2022/06/08/2458326/0/en/Emerging-technology-gives-first-ever-global-view-of-hidden-vessels.html,6/8/2022,Emerging technology gives first ever global view of hidden vessels&nbsp;&nbsp;GlobeNewswire,GlobeNewswire,Sensors-Radar
World Wind Day: from energy transition to the protection of local bird populations | REVE News of the wind sector in Spain and in the world - REVE,https://www.evwind.es/2022/06/15/world-wind-day-from-energy-transition-to-the-protection-of-local-bird-populations/86528,6/15/2022,World Wind Day: from energy transition to the protection of local bird populations | REVE News of the wind sector in Spain and in the world&nbsp;&nbsp;REVE,REVE,Sensors-Radar
"Questar uses AI, predictive analytics to keep fleets on the road - FierceElectronics",https://www.fierceelectronics.com/sensors/questar-uses-ai-predictive-analytics-keep-fleets-road,6/14/2022,"Questar uses AI, predictive analytics to keep fleets on the road&nbsp;&nbsp;FierceElectronics",FierceElectronics,Sensors-Radar
Assam: Speed-check cameras to prevent Kaziranga wildlife killings - Times of India,https://timesofindia.indiatimes.com/city/guwahati/assam-speed-check-cameras-to-prevent-kaziranga-wildlife-killings/articleshow/92113325.cms,6/9/2022,Assam: Speed-check cameras to prevent Kaziranga wildlife killings&nbsp;&nbsp;Times of India,Times of India,Sensors-Radar
"How to think, move, act like a farmer with precision autonomous farm tech: Bansal - FierceElectronics",https://www.fierceelectronics.com/sensors/how-think-move-act-farmer-precision-autonomous-farm-tech,6/13/2022,"How to think, move, act like a farmer with precision autonomous farm tech: Bansal&nbsp;&nbsp;FierceElectronics",FierceElectronics,Sensors-Radar
What are best practices for IoT system security? A listical of sorts - FierceElectronics,https://www.fierceelectronics.com/sensors/what-are-best-practices-iot-system-security-listical-sorts?utm_source=rss&utm_medium=rss&utm_campaign=what-are-best-practices-for-iot-system-security-a-listical-of-sorts,6/15/2022,What are best practices for IoT system security? A listical of sorts&nbsp;&nbsp;FierceElectronics,FierceElectronics,Sensors-Radar
Metagenomics to characterize sediment microbial biodiversity associated with fishing exposure within the Stellwagen Bank National Marine Sanctuary | Scientific Reports - Nature.com,https://www.nature.com/articles/s41598-022-13409-5,6/9/2022,Metagenomics to characterize sediment microbial biodiversity associated with fishing exposure within the Stellwagen Bank National Marine Sanctuary | Scientific Reports&nbsp;&nbsp;Nature.com,Nature.com,Sensors-Radar
IKIN ships holographic ARC terminal with no need for goggles - FierceElectronics,https://www.fierceelectronics.com/sensors/ikin-arc-ships-commercial-holographic-desktop-terminal-no-need-goggles,6/13/2022,IKIN ships holographic ARC terminal with no need for goggles&nbsp;&nbsp;FierceElectronics,FierceElectronics,Sensors-Radar
LaMDA IQ debate swirls over who (or what) is tone deaf: update - FierceElectronics,https://www.fierceelectronics.com/sensors/lamdas-iq-raises-debate-over-who-or-what-tone-deaf,6/13/2022,LaMDA IQ debate swirls over who (or what) is tone deaf: update&nbsp;&nbsp;FierceElectronics,FierceElectronics,Sensors-Radar
"To fight illegal fishing in the Galapagos, Ecuador turns to Canadian satellite and sensing technology - CBC News",https://www.cbc.ca/news/world/galapagos-illegal-fishing-satellite-technology-1.6469424,6/4/2022,"To fight illegal fishing in the Galapagos, Ecuador turns to Canadian satellite and sensing technology&nbsp;&nbsp;CBC News",CBC News,Sensors-Radar
5 expert tips on introducing a smart factory system: Whitley - FierceElectronics,https://www.fierceelectronics.com/sensors/5-expert-tips-introducing-smart-factory-system-whitley,6/10/2022,5 expert tips on introducing a smart factory system: Whitley&nbsp;&nbsp;FierceElectronics,FierceElectronics,Sensors-Radar
How are Sensors Used in Conservation Efforts? - AZoSensors,https://www.azosensors.com/article.aspx?ArticleID=2414,12/29/2021,How are Sensors Used in Conservation Efforts?&nbsp;&nbsp;AZoSensors,AZoSensors,Sensors-Radar
"Identifying conservation technology needs, barriers, and opportunities | Scientific Reports - Nature.com",https://www.nature.com/articles/s41598-022-08330-w,3/21/2022,"Identifying conservation technology needs, barriers, and opportunities | Scientific Reports&nbsp;&nbsp;Nature.com",Nature.com,Sensors-Radar
Transforming intrusion alarm systems with power-intelligent analog computing architecture - FierceElectronics,https://www.fierceelectronics.com/sensors/transforming-intrusion-alarm-systems-power-intelligent-analog-computing-architecture,6/8/2022,Transforming intrusion alarm systems with power-intelligent analog computing architecture&nbsp;&nbsp;FierceElectronics,FierceElectronics,Sensors-Radar
Arctic engineers develop innovative radar method to detect polar bears - Verve Times,https://vervetimes.com/arctic-engineers-develop-innovative-radar-method-to-detect-polar-bears/,5/25/2022,Arctic engineers develop innovative radar method to detect polar bears&nbsp;&nbsp;Verve Times,Verve Times,Sensors-Radar
"Wearable shipments drop first time in 1Q except Apple, IDC says - FierceElectronics",https://www.fierceelectronics.com/sensors/wearable-shipments-drop-first-time-1q-except-apple-idc-says,6/13/2022,"Wearable shipments drop first time in 1Q except Apple, IDC says&nbsp;&nbsp;FierceElectronics",FierceElectronics,Sensors-Radar
Automotive Intelligent Lighting System Market | APAC to occupy 40% market share | Technavio - The Auto Channel,https://www.theautochannel.com/news/2022/06/13/1154774-automotive-intelligent-lighting-system-market-apac-to-occupy-40-market.html,6/13/2022,Automotive Intelligent Lighting System Market | APAC to occupy 40% market share | Technavio&nbsp;&nbsp;The Auto Channel,The Auto Channel,Sensors-Radar
Garmin Varia RCT715 Camera + Radar In-Depth Review - DC Rainmaker,https://www.dcrainmaker.com/2022/05/garmin-rct715-varia-rearview-bikelight-radar-camera-review.html,5/18/2022,Garmin Varia RCT715 Camera + Radar In-Depth Review&nbsp;&nbsp;DC Rainmaker,DC Rainmaker,Sensors-Radar
Astrocast acquiring Hiber as IoT M&A activity heats up - FierceElectronics,https://www.fierceelectronics.com/iot-wireless/astrocast-acquiring-hiber-iot-ma-activity-heats,6/6/2022,Astrocast acquiring Hiber as IoT M&amp;A activity heats up&nbsp;&nbsp;FierceElectronics,FierceElectronics,Sensors-Radar
HENSOLDT defence industry developer of Land Air Sea Solutions and Products | Germany German defence industry company UK | Europe defence industry company UK - Army Recognition,https://www.armyrecognition.com/germany_german_defence_industry_company_uk/hensoldt_defence_industry_developer_of_land_air_sea_solutions_and_products.html,6/10/2022,HENSOLDT defence industry developer of Land Air Sea Solutions and Products | Germany German defence industry company UK | Europe defence industry company UK&nbsp;&nbsp;Army Recognition,Army Recognition,Sensors-Radar
Arm aims new image signal processor at IoT embedded computer vision apps - FierceElectronics,https://www.fierceelectronics.com/iot-wireless/arm-aims-new-image-signal-processor-iot-embedded-computer-vision-apps,6/8/2022,Arm aims new image signal processor at IoT embedded computer vision apps&nbsp;&nbsp;FierceElectronics,FierceElectronics,Sensors-Radar
NXP Semiconductors N.V. (NXPI) CEO Kurt Sievers Presents at Jefferies and Nasdaq Conference Presentation (Transcript) - Seeking Alpha,https://seekingalpha.com/article/4518356-nxp-semiconductors-n-v-nxpi-ceo-kurt-sievers-presents-jefferies-and-nasdaq-conference,6/14/2022,NXP Semiconductors N.V. (NXPI) CEO Kurt Sievers Presents at Jefferies and Nasdaq Conference Presentation (Transcript)&nbsp;&nbsp;Seeking Alpha,Seeking Alpha,Sensors-Radar
Special Topics | US Geological Survey - United States Geological Survey (.gov),https://www.usgs.gov/special-topics,5/31/2022,Special Topics | US Geological Survey&nbsp;&nbsp;United States Geological Survey (.gov),United States Geological Survey (.gov),Sensors-Radar
Space Infrastructure for a Sustainable Arctic: Opportunities and Challenges of Spaceport Development in the High North - The Arctic Institute,https://www.thearcticinstitute.org/space-infrastructure-sustainable-arctic-opportunities-and-challenges-spaceport-development-high-north/,5/31/2022,Space Infrastructure for a Sustainable Arctic: Opportunities and Challenges of Spaceport Development in the High North&nbsp;&nbsp;The Arctic Institute,The Arctic Institute,Sensors-Radar
AMD and Qualcomm team up on business laptop silicon - FierceElectronics,https://www.fierceelectronics.com/iot-wireless/amd-and-qualcomm-team-business-laptop-silicon,5/17/2022,AMD and Qualcomm team up on business laptop silicon&nbsp;&nbsp;FierceElectronics,FierceElectronics,Sensors-Radar
Effectiveness of protection areas in safeguarding biodiversity and ecosystem services in Tibet Autonomous Region | Scientific Reports - Nature.com,https://www.nature.com/articles/s41598-021-03653-6,1/21/2022,Effectiveness of protection areas in safeguarding biodiversity and ecosystem services in Tibet Autonomous Region | Scientific Reports&nbsp;&nbsp;Nature.com,Nature.com,Sensors-Radar
New AMD starter kit aims to accelerate robotics development - FierceElectronics,https://www.fierceelectronics.com/iot-wireless/new-amd-starter-kit-aims-accelerate-robotics-development,5/17/2022,New AMD starter kit aims to accelerate robotics development&nbsp;&nbsp;FierceElectronics,FierceElectronics,Sensors-Radar
Reading the Landscape - NASA Applied Science,https://appliedsciences.nasa.gov/our-impact/people/reading-landscape,1/21/2022,Reading the Landscape&nbsp;&nbsp;NASA Applied Science,NASA Applied Science,Sensors-Radar
The Nature Conservancy Announces New Institute for Scientific Research in California - The Nature Conservancy,https://www.nature.org/en-us/newsroom/ca-point-conception-institute/,4/15/2022,The Nature Conservancy Announces New Institute for Scientific Research in California&nbsp;&nbsp;The Nature Conservancy,The Nature Conservancy,Sensors-Radar
OM System OM-1 review - TechRadar,https://www.techradar.com/reviews/om-system-om-1,5/27/2022,OM System OM-1 review&nbsp;&nbsp;TechRadar,TechRadar,Sensors-Radar
Canada's human footprint reveals large intact areas juxtaposed against areas under immense anthropogenic pressure - FACETS Journal,https://www.facetsjournal.com/doi/10.1139/facets-2021-0063,3/19/2022,Canada's human footprint reveals large intact areas juxtaposed against areas under immense anthropogenic pressure&nbsp;&nbsp;FACETS Journal,FACETS Journal,Sensors-Radar
Does Edge computing make sense for the SMB or SME? - TechRadar,https://www.techradar.com/features/does-edge-computing-make-sense-for-the-smb-or-sme,5/24/2022,Does Edge computing make sense for the SMB or SME?&nbsp;&nbsp;TechRadar,TechRadar,Sensors-Radar
The Impact of Drones in Canada for the Enterprise - Commercial UAV News,https://www.commercialuavnews.com/international/the-impact-of-drones-in-canada-for-the-enterprise,6/8/2022,The Impact of Drones in Canada for the Enterprise&nbsp;&nbsp;Commercial UAV News,Commercial UAV News,Sensors-Radar
US Congress Holds Hearing on Increased Traffic Deaths - TheTruthAboutCars,https://www.thetruthaboutcars.com/2022/06/u-s-congress-holds-hearing-on-increased-traffic-deaths/,6/8/2022,US Congress Holds Hearing on Increased Traffic Deaths&nbsp;&nbsp;TheTruthAboutCars,TheTruthAboutCars,Sensors-Radar
Lack of Transparency Hampers Ability to Prioritize Funds for Nature Protection - Lab Manager Magazine,https://www.labmanager.com/news/lack-of-transparency-hampers-ability-to-prioritize-funds-for-nature-protection-27798,3/24/2022,Lack of Transparency Hampers Ability to Prioritize Funds for Nature Protection&nbsp;&nbsp;Lab Manager Magazine,Lab Manager Magazine,Sensors-Radar
Can the Pentagon Protect the Strategic Stronghold of Guam? - The National Interest Online,https://nationalinterest.org/blog/buzz/can-pentagon%C2%A0protect-strategic-stronghold-guam-202705,5/28/2022,Can the Pentagon Protect the Strategic Stronghold of Guam?&nbsp;&nbsp;The National Interest Online,The National Interest Online,Sensors-Radar
Journeying in biocultural diversity and conservation philanthropy: Q&A with Ken Wilson - Mongabay.com,https://news.mongabay.com/2022/02/journeying-in-biocultural-diversity-and-conservation-philanthropy-qa-with-ken-wilson/,2/8/2022,Journeying in biocultural diversity and conservation philanthropy: Q&amp;A with Ken Wilson&nbsp;&nbsp;Mongabay.com,Mongabay.com,Sensors-Radar
The year in rainforests 2021 - Mongabay.com,https://news.mongabay.com/2021/12/the-year-in-rainforests-2021/,12/29/2021,The year in rainforests 2021&nbsp;&nbsp;Mongabay.com,Mongabay.com,Sensors-Radar
A global record of annual terrestrial Human Footprint dataset from 2000 to 2018 | Scientific Data - Nature.com,https://www.nature.com/articles/s41597-022-01284-8,4/19/2022,A global record of annual terrestrial Human Footprint dataset from 2000 to 2018 | Scientific Data&nbsp;&nbsp;Nature.com,Nature.com,Sensors-Radar
Planet's Data Helps Amnesty International Tackle Deforestation In Cambodia - planet.com,https://www.planet.com/pulse/planets-data-helps-amnesty-international-tackle-deforestation-in-cambodia/,4/1/2022,Planet's Data Helps Amnesty International Tackle Deforestation In Cambodia&nbsp;&nbsp;planet.com,planet.com,Sensors-Radar
Deforestation notches up along logging roads on PNG's New Britain Island - Mongabay.com,https://news.mongabay.com/2021/10/deforestation-notches-up-along-logging-roads-on-pngs-new-britain-island/,10/21/2021,Deforestation notches up along logging roads on PNG's New Britain Island&nbsp;&nbsp;Mongabay.com,Mongabay.com,Sensors-Radar
The Hacker Mind Podcast: Hacking Teslas - Security Boulevard,https://securityboulevard.com/2022/06/the-hacker-mind-podcast-hacking-teslas/,6/8/2022,The Hacker Mind Podcast: Hacking Teslas&nbsp;&nbsp;Security Boulevard,Security Boulevard,Sensors-Radar
Mapping native and non-native vegetation in the Brazilian Cerrado using freely available satellite products | Scientific Reports - Nature.com,https://www.nature.com/articles/s41598-022-05332-6,1/28/2022,Mapping native and non-native vegetation in the Brazilian Cerrado using freely available satellite products | Scientific Reports&nbsp;&nbsp;Nature.com,Nature.com,Sensors-Radar
The economic importance of biodiversity | JP Morgan Asset Management - J.P. Morgan & Co.,https://am.jpmorgan.com/us/en/asset-management/adv/insights/portfolio-insights/sustainable-investing/the-economic-importance-of-biodiversity/,5/9/2022,The economic importance of biodiversity | JP Morgan Asset Management&nbsp;&nbsp;J.P. Morgan & Co.,J.P. Morgan & Co.,Sensors-Radar
Tracking agricultural-related deforestation - Phys.org,https://phys.org/news/2022-05-tracking-agricultural-related-deforestation.html,5/5/2022,Tracking agricultural-related deforestation&nbsp;&nbsp;Phys.org,Phys.org,Sensors-Radar
