Title,Link,pubDate,Description,Source,Tag
This cute baby deer was saved from a gruesome fate thanks to DJI's thermal drone technology - Digital Camera World,https://www.digitalcameraworld.com/news/baby-deer-saved-from-a-gruesome-fate-thanks-to-dji-thermal-drones,6/14/2022,This cute baby deer was saved from a gruesome fate thanks to DJI's thermal drone technology&nbsp;&nbsp;Digital Camera World,Digital Camera World,Sensors-Thermal
Current Affairs in Short: 8 June 2022 - Jagran Josh,https://www.jagranjosh.com/current-affairs/current-affairs-in-short-8-june-2022-1654690783-1,6/8/2022,Current Affairs in Short: 8 June 2022&nbsp;&nbsp;Jagran Josh,Jagran Josh,Sensors-Thermal
These flying robots protect endangered wildlife - Science News for Students,https://www.sciencenewsforstudents.org/article/drones-protect-endangered-wildlife-ai-conservation,3/10/2022,These flying robots protect endangered wildlife&nbsp;&nbsp;Science News for Students,Science News for Students,Sensors-Thermal
Drones and tech keeping track of koalas - 7NEWS,https://7news.com.au/news/wildlife/drones-and-tech-keeping-track-of-koalas-c-7056039,6/6/2022,Drones and tech keeping track of koalas&nbsp;&nbsp;7NEWS,7NEWS,Sensors-Thermal
Stony coral tissue loss disease decimated Caribbean coral populations and reshaped reef functionality | Communications Biology - Nature.com,https://www.nature.com/articles/s42003-022-03398-6,6/9/2022,Stony coral tissue loss disease decimated Caribbean coral populations and reshaped reef functionality | Communications Biology&nbsp;&nbsp;Nature.com,Nature.com,Sensors-Thermal
Thinning increases forest resiliency during unprecedented drought | Scientific Reports - Nature.com,https://www.nature.com/articles/s41598-022-12982-z,5/31/2022,Thinning increases forest resiliency during unprecedented drought | Scientific Reports&nbsp;&nbsp;Nature.com,Nature.com,Sensors-Thermal
"Tech revolution holds world of promise for conservation, but challenges persist - Mongabay.com",https://news.mongabay.com/2022/02/tech-revolution-holds-world-of-promise-for-conservation-but-challenges-persist/,2/2/2022,"Tech revolution holds world of promise for conservation, but challenges persist&nbsp;&nbsp;Mongabay.com",Mongabay.com,Sensors-Thermal
Photonics applications emerge for agriculture - Laser Focus World,https://www.laserfocusworld.com/detectors-imaging/article/14276564/photonics-applications-emerge-for-agriculture,5/19/2022,Photonics applications emerge for agriculture&nbsp;&nbsp;Laser Focus World,Laser Focus World,Sensors-Thermal
Crystal Diamond Mirrors Stand Up to Continuous-Wave Laser Powers - Photonics.com,https://www.photonics.com/Articles/Crystal_Diamond_Mirrors_Stand_Up_to/a68092,6/10/2022,Crystal Diamond Mirrors Stand Up to Continuous-Wave Laser Powers&nbsp;&nbsp;Photonics.com,Photonics.com,Sensors-Thermal
"Tigers of Chandrapur power plant: Not fit for forest, can’t stay in urban areas - Times of India",https://timesofindia.indiatimes.com/city/nagpur/tigers-of-chandrapur-power-plant-not-fit-for-forest-cant-stay-in-urban-areas/articleshow/91714609.cms,5/22/2022,"Tigers of Chandrapur power plant: Not fit for forest, can’t stay in urban areas&nbsp;&nbsp;Times of India",Times of India,Sensors-Thermal
The 10 Best Experiences at Baha Mar - Gotham | Modern Luxury,https://gothammag.com/the-10-best-experiences-at-baha-mar,5/27/2022,The 10 Best Experiences at Baha Mar&nbsp;&nbsp;Gotham | Modern Luxury,Gotham | Modern Luxury,Sensors-Thermal
There's nowhere to hide: This drone can track targets through forests - The Next Web,https://thenextweb.com/news/theres-nowhere-hide-drone-can-track-targets-through-forests,5/24/2022,There's nowhere to hide: This drone can track targets through forests&nbsp;&nbsp;The Next Web,The Next Web,Sensors-Thermal
Bridging the gap between public understanding and realities of living alongside elephants - Open Access Government,https://www.openaccessgovernment.org/elephant-conservation-china/129491/,2/11/2022,Bridging the gap between public understanding and realities of living alongside elephants&nbsp;&nbsp;Open Access Government,Open Access Government,Sensors-Thermal
Mapping riparian zone macro litter abundance using combination of optical and thermal sensor | Scientific Reports - Nature.com,https://www.nature.com/articles/s41598-022-09974-4,4/12/2022,Mapping riparian zone macro litter abundance using combination of optical and thermal sensor | Scientific Reports&nbsp;&nbsp;Nature.com,Nature.com,Sensors-Thermal
Drones to support wildlife conservation - Innovation Origins,https://innovationorigins.com/en/selected/drones-to-support-wildlife-conservation/,12/8/2021,Drones to support wildlife conservation&nbsp;&nbsp;Innovation Origins,Innovation Origins,Sensors-Thermal
Property Development in Puerto Rico Hurts Protected Areas - Bloomberg,https://www.bloomberg.com/news/articles/2022-05-06/builders-hurt-protected-areas-in-climate-weary-puerto-rico,5/6/2022,Property Development in Puerto Rico Hurts Protected Areas&nbsp;&nbsp;Bloomberg,Bloomberg,Sensors-Thermal
A microfluidic paper analytical device using capture aptamers for the detection of PfLDH in blood matrices - Malaria Journal - Malaria Journal,https://malariajournal.biomedcentral.com/articles/10.1186/s12936-022-04187-6,6/7/2022,A microfluidic paper analytical device using capture aptamers for the detection of PfLDH in blood matrices - Malaria Journal&nbsp;&nbsp;Malaria Journal,Malaria Journal,Sensors-Thermal
Apex scavengers from different European populations converge at threatened savannah landscapes | Scientific Reports - Nature.com,https://www.nature.com/articles/s41598-022-06436-9,2/15/2022,Apex scavengers from different European populations converge at threatened savannah landscapes | Scientific Reports&nbsp;&nbsp;Nature.com,Nature.com,Sensors-Thermal
The Impact of Drones in Canada for the Enterprise - Commercial UAV News,https://www.commercialuavnews.com/international/the-impact-of-drones-in-canada-for-the-enterprise,6/8/2022,The Impact of Drones in Canada for the Enterprise&nbsp;&nbsp;Commercial UAV News,Commercial UAV News,Sensors-Thermal
The Benefits of Explosion-Protected Cameras in High-Risk Environments - POWER magazine,https://www.powermag.com/the-benefits-of-explosion-protected-cameras-in-high-risk-environments/,12/9/2021,The Benefits of Explosion-Protected Cameras in High-Risk Environments&nbsp;&nbsp;POWER magazine,POWER magazine,Sensors-Thermal
How Tech Reveals the 'Secret Lives' of Animals - The New York Times,https://www.nytimes.com/interactive/2021/12/14/climate/tracking-wildlife.html,12/14/2021,How Tech Reveals the 'Secret Lives' of Animals&nbsp;&nbsp;The New York Times,The New York Times,Sensors-Thermal
Unexpected flow behavior in liquid metals — ScienceDaily - Verve Times,https://vervetimes.com/unexpected-flow-behavior-in-liquid-metals-sciencedaily/,5/20/2022,Unexpected flow behavior in liquid metals — ScienceDaily&nbsp;&nbsp;Verve Times,Verve Times,Sensors-Thermal
Dynamic spectrum sharing between active and passive users above 100 GHz | Communications Engineering - Nature.com,https://www.nature.com/articles/s44172-022-00002-x,5/26/2022,Dynamic spectrum sharing between active and passive users above 100 GHz | Communications Engineering&nbsp;&nbsp;Nature.com,Nature.com,Sensors-Thermal
Six pieces of technology that bring us closer to wildlife - Techaeris,https://techaeris.com/2021/09/13/six-pieces-of-technology-that-bring-us-closer-to-wildlife/,9/13/2021,Six pieces of technology that bring us closer to wildlife&nbsp;&nbsp;Techaeris,Techaeris,Sensors-Thermal
Latest version of Elios caged drone gets LiDAR for 3D mapping - New Atlas,https://newatlas.com/drones/elios-3-drone-3d-mapping/,5/25/2022,Latest version of Elios caged drone gets LiDAR for 3D mapping&nbsp;&nbsp;New Atlas,New Atlas,Sensors-Thermal
Yellowstone flooding – live: Tourists warned National Park closed for months as video shows perilous escape - msnNOW,https://www.msn.com/en-gb/news/world/yellowstone-flooding-%E2%80%93-live-tourists-warned-national-park-closed-for-months-as-video-shows-perilous-escape/ar-AAYt8WB,6/15/2022,Yellowstone flooding – live: Tourists warned National Park closed for months as video shows perilous escape&nbsp;&nbsp;msnNOW,msnNOW,Sensors-Thermal
Changes in land use enhance the sensitivity of tropical ecosystems to fire-climate extremes | Scientific Reports - Nature.com,https://www.nature.com/articles/s41598-022-05130-0,1/19/2022,Changes in land use enhance the sensitivity of tropical ecosystems to fire-climate extremes | Scientific Reports&nbsp;&nbsp;Nature.com,Nature.com,Sensors-Thermal
"The Durrells (yes, those Durrells) use drones against wildlife poachers - DroneDJ",https://dronedj.com/2021/07/14/the-durrells-yes-those-durrells-use-drones-to-protect-endangered-animals/,7/14/2021,"The Durrells (yes, those Durrells) use drones against wildlife poachers&nbsp;&nbsp;DroneDJ",DroneDJ,Sensors-Thermal
Newsletter 2022-02-03 - Mongabay.com,https://news.mongabay.com/newsletter/newsletter-2022-02-03/,2/3/2022,Newsletter 2022-02-03&nbsp;&nbsp;Mongabay.com,Mongabay.com,Sensors-Thermal
"How to prevent mass extinction in the ocean using AI, robots and 3D printers - Phys.org",https://phys.org/news/2021-12-mass-extinction-ocean-ai-robots.html,12/21/2021,"How to prevent mass extinction in the ocean using AI, robots and 3D printers&nbsp;&nbsp;Phys.org",Phys.org,Sensors-Thermal
The Bomb Next Door - Thomas A. Bass - The American Scholar,https://theamericanscholar.org/the-bomb-next-door/,6/1/2022,The Bomb Next Door - Thomas A. Bass&nbsp;&nbsp;The American Scholar,The American Scholar,Sensors-Thermal
Cattle-related risk factors for malaria in southwest Ethiopia: a cross-sectional study - Malaria Journal - Malaria Journal,https://malariajournal.biomedcentral.com/articles/10.1186/s12936-022-04202-w,6/10/2022,Cattle-related risk factors for malaria in southwest Ethiopia: a cross-sectional study - Malaria Journal&nbsp;&nbsp;Malaria Journal,Malaria Journal,Sensors-Thermal
"Urgent action required to protect world's coral reefs from disappearing within three decades, warn experts - Science Daily",https://www.sciencedaily.com/releases/2022/04/220418164949.htm,4/18/2022,"Urgent action required to protect world's coral reefs from disappearing within three decades, warn experts&nbsp;&nbsp;Science Daily",Science Daily,Sensors-Thermal
High-resolution deposition of conductive and insulating materials at micrometer scale on complex substrates | Scientific Reports - Nature.com,https://www.nature.com/articles/s41598-022-13352-5,6/4/2022,High-resolution deposition of conductive and insulating materials at micrometer scale on complex substrates | Scientific Reports&nbsp;&nbsp;Nature.com,Nature.com,Sensors-Thermal
"South Africa: Dirty Air Is Invisible, but a Real Threat to Health - AllAfrica - Top Africa News",https://allafrica.com/stories/202205180077.html,5/18/2022,"South Africa: Dirty Air Is Invisible, but a Real Threat to Health&nbsp;&nbsp;AllAfrica - Top Africa News",AllAfrica - Top Africa News,Sensors-Thermal
Bear Survives Wildfire and Adopts Toy Bear - News Radio 1310 KLIX,https://newsradio1310.com/bear-survives-wildfire-and-adopts-toy-bear/,6/7/2022,Bear Survives Wildfire and Adopts Toy Bear&nbsp;&nbsp;News Radio 1310 KLIX,News Radio 1310 KLIX,Sensors-Thermal
"The Rainforests of the Sea—Coral Reefs—Likely to Vanish By 2050, Claims New Research | The Weather Channel - Articles from The Weather Channel | weather.com - The Weather Channel",https://weather.com/en-IN/india/climate-change/news/2022-04-18-coral-reefs-likely-to-vanish-by-2050,4/18/2022,"The Rainforests of the Sea—Coral Reefs—Likely to Vanish By 2050, Claims New Research | The Weather Channel - Articles from The Weather Channel | weather.com&nbsp;&nbsp;The Weather Channel",The Weather Channel,Sensors-Thermal
Crew queues zoo for a thermal review | Lighter Side | Jan 2022 - Photonics.com,https://www.photonics.com/Articles/Crew_queues_zoo_for_a_thermal_review/a67675,1/11/2022,Crew queues zoo for a thermal review | Lighter Side | Jan 2022&nbsp;&nbsp;Photonics.com,Photonics.com,Sensors-Thermal
From great chaos to great restoration: 'Qinling Mountains defense battle' reflects China's efforts to protect its ecological environment - Global Times,https://www.globaltimes.cn/page/202112/1241471.shtml,12/14/2021,From great chaos to great restoration: 'Qinling Mountains defense battle' reflects China's efforts to protect its ecological environment&nbsp;&nbsp;Global Times,Global Times,Sensors-Thermal
